major,department,required_courses,notes,advising_tips
Computer Science,Computer Science,"COSC111; COSC241; COSC242; COSC310; COSC331; COSC332; COSC350; COSC490; MATH141; MATH241; MATH242; STAT302","Students should complete core programming and math requirements before upper-level systems and AI electives.","Plan early for COSC490 and make sure foundational programming plus math courses are completed before heavy 300 and 400 level terms."
Information Systems,Information Science and Systems,"ISYS201; ISYS220; ISYS310; ISYS340; ACCT201; ECON201; STAT302; ENGL101; ENGL102","Students usually balance business core requirements with information systems and analytics courses.","Prioritize database analytics and business process courses early if you want internships in consulting or enterprise systems."
Biology,Biology,"BIOL101; BIOL102; CHEM101; CHEM102; PHYS101; PHYS102; MATH141; STAT302; BIOL320; BIOL410","Pre-health students should coordinate major requirements with professional school prerequisites.","Meet with a department advisor each semester if you are preparing for medical dental pharmacy or research pathways."
Psychology,Psychology,"PSYC101; PSYC210; PSYC301; PSYC302; STAT302; BIOL101; ENGL101; ENGL102","Psychology students need strong research and writing preparation for internships and graduate study.","Take statistics and research methods on time so you are ready for upper-level lab and practicum opportunities."
Business Administration,Business Administration,"ACCT201; ACCT202; ECON201; ECON202; MGMT220; MKTG331; FINA300; STAT302; ENGL101; ENGL102","Students often choose a concentration after completing lower-division business core requirements.","Use sophomore and junior advising meetings to align electives with finance marketing entrepreneurship or management goals."
Electrical Engineering,Electrical and Computer Engineering,"ENGE101; ENGE102; EEGR203; EEGR205; EEGR301; EEGR317; MATH141; MATH241; PHYS101; PHYS102","Engineering students should sequence math physics and circuits carefully because later courses build directly on them.","Avoid delaying calculus physics or circuits because that can slow progress toward design-intensive upper-level coursework."
