major,department,required_courses,notes,advising_tips
Computer Science,Computer Science,"COSC111; COSC241; COSC242; COSC310; COSC331; COSC332; COSC350; COSC490; MATH141; MATH241; MATH242; STAT302","Students should complete core programming and math requirements before upper-level systems and AI electives.","Plan early for COSC490 and make sure foundational programming plus math courses are completed before heavy 300 and 400 level terms."
Criminal Justice,"Sociology and Anthropology","CRJU101; CRJU210; CRJU305; CRJU308; CRJU331; CRJU408; ENGL101; PSYC101","Morgan supports Criminal Justice through an undergraduate sociology and anthropology-aligned justice path with social systems and policy context.","Start with the intro justice sequence early so upper-level policy, corrections, and research work has a clear foundation."
Actuarial Science,Actuarial Science,"INSS141; MATH130; MATH241; MATH242; MATH243; MATH312; MATH331; MATH340; MATH346; MATH363; MATH364; MATH431","Official Morgan actuarial science degree options emphasize statistics probability finance-aligned preparation and Society of Actuaries exam readiness.","Use early advising to sequence calculus probability modeling and finance-related work so you stay ready for actuarial exams internships and upper-level quantitative courses."
Information Science,Information Science and Systems,"INSS201; INSS220; INSS310; INSS340; ACCT201; ECON201; STAT302; ENGL101; ENGL102","Students usually balance business core requirements with information systems and analytics courses.","Prioritize database analytics and business process courses early if you want internships in consulting or enterprise systems."
Chemistry,Chemistry,"CHEM101; CHEM102; CHEM201; CHEM202; CHEM301; CHEM302; MATH141; PHYS101; PHYS102; ENGL101","Morgan's chemistry undergraduate program highlights rigorous laboratory science preparation and points students to the catalog for detailed track-specific planning.","Use early advising to choose between the general and ACS-oriented chemistry paths, and stay on sequence with chemistry, math, and physics."
Economics,Economics,"ECON201; ECON202; ECON301; ECON302; ECON401; ECON410; STAT302; ENGL101; ENGL102","Morgan's economics program emphasizes economic literacy, policy reasoning, and preparation for both private-sector work and graduate study.","Complete the principles and intermediate sequence early so econometrics, policy analysis, and senior research stay on track."
Finance,Accounting and Finance,"ACCT201; ACCT202; ECON201; ECON202; FINA300; MGMT220; MKTG210; STAT302; ENGL101; ENGL102","Finance at Morgan builds on accounting, economics, and quantitative reasoning with strong career preparation in corporate and investment settings.","Finish the accounting and economics core early so upper-level finance and internship planning are not delayed."
Political Science,Political Science,"POSC101; POSC201; POSC307; POSC314; POSC385; POSC402; ENGL101; ENGL102; HIST101","Morgan's political science department emphasizes leadership, international perspective, and strong student-faculty engagement.","Stay on pace with writing and methods-oriented work so internships, public-service preparation, and senior seminar work fit naturally into the degree."
Biology,Biology,"BIOL101; BIOL102; CHEM101; CHEM102; PHYS101; PHYS102; MATH141; STAT302; BIOL320; BIOL410","Pre-health students should coordinate major requirements with professional school prerequisites.","Meet with a department advisor each semester if you are preparing for medical dental pharmacy or research pathways."
Psychology,Psychology,"PSYC101; PSYC210; PSYC301; PSYC302; STAT302; BIOL101; ENGL101; ENGL102","Psychology students need strong research and writing preparation for internships and graduate study.","Take statistics and research methods on time so you are ready for upper-level lab and practicum opportunities."
Business Administration,Business Administration,"ACCT201; ACCT202; ECON201; ECON202; MGMT220; MKTG210; MGMT330; MGMT410; FINA300; STAT302; ENGL101; ENGL102","Students build a shared business core before moving into upper-level management and strategy work.","Complete accounting economics marketing and quantitative foundations before strategic management planning."
Electrical Engineering,Electrical and Computer Engineering,"ENGE101; ENGE102; EEGR203; EEGR205; EEGR301; EEGR317; MATH141; MATH241; PHYS101; PHYS102","Engineering students should sequence math physics and circuits carefully because later courses build directly on them.","Avoid delaying calculus physics or circuits because that can slow progress toward design-intensive upper-level coursework."
Mathematics,Mathematics,"MATH141; MATH241; MATH242; MATH310; MATH320; STAT302; PHYS101; ENGL101; ENGL102","Mathematics students should balance proof-based work, applied quantitative courses, and supporting science requirements.","Take calculus and linear algebra early so you are ready for upper-level proof, modeling, and methods courses."
English,English,"ENGL101; ENGL102; ENGL220; ENGL310; ENGL320; ENGL350; HIST101; COMM200","English majors should strengthen writing, literary analysis, and communication early while planning electives around career or graduate goals.","Build a strong composition and survey foundation before upper-level writing, theory, and capstone-style seminar work."
History,History,"HIST101; HIST102; HIST210; HIST310; HIST320; ENGL101; ENGL102; POSC201","History students benefit from balancing survey, methods, and writing-intensive coursework across multiple semesters.","Stay on track with writing and research-heavy courses so internship, teaching, law, or graduate-study plans remain flexible."
Sociology,Sociology,"SOCY101; SOCY201; SOCY305; SOCY320; STAT302; PSYC101; ENGL101; ENGL102","Sociology students should combine theory, methods, statistics, and applied social inquiry across the degree.","Take methods and statistics on time so you are ready for upper-level research, policy, and community-focused work."
Accounting,Accounting,"ACCT201; ACCT202; ACCT301; ACCT302; ECON201; ECON202; STAT302; MGMT220; ENGL101; ENGL102","Accounting students should complete the business and quantitative core early to stay ready for internship and CPA-oriented planning.","Move through accounting and economics in sequence and use junior-year advising to plan for internships, public accounting, or corporate finance roles."
Civil Engineering,Civil and Environmental Engineering,"ENGE101; ENGE102; CEGR201; CEGR220; CEGR310; CEGR320; MATH141; MATH241; PHYS101; PHYS102","Civil Engineering students need steady progress through math, physics, and mechanics because design courses depend on them.","Do not delay calculus, physics, or statics because they feed directly into structural, transportation, and water-resources work."
Nursing,Nursing,"NURS101; NURS201; NURS220; NURS301; NURS320; BIOL101; BIOL102; CHEM101; PSYC101; STAT302","Nursing students should coordinate science prerequisites, clinical sequencing, and health-support coursework carefully.","Stay on pace with anatomy-related science, psychology, and clinical-prep courses so you remain eligible for upper-level nursing progression."
Cloud Computing,Cloud Computing,"CLDC101; CLDC220; CLDC310; CLDC340; CLDC420; COSC111; COSC241; STAT302; MATH141","Cloud Computing students should blend programming infrastructure automation and security as they move from foundations into platform design.","Take programming and cloud infrastructure early so upper-level security automation and DevOps courses fit naturally into junior and senior planning."
Architecture,Architecture,"ARCH101; ARCH102; ARCH220; ARCH201; ARCH310; ARCH320; ARCH401; MATH141; PHYS101; ENGL101","Architecture students need a steady sequence of studio graphics history and building systems courses to stay on pace for upper-level design work.","Treat studio and graphics courses as anchors each term and avoid delaying structures or building-systems work."
Construction Management,Construction Management,"CMGT210; CMGT220; CMGT310; CMGT410; MATH141; PHYS101; ENGL101; COMM200","Morgan construction management students progress through materials, estimating, scheduling, and project delivery preparation.","Treat the construction sequence as a chain and avoid delaying estimating or scheduling if you want smoother upper-level planning."
Interior Design,Interior Design,"INTD210; INTD220; INTD310; INTD410; ARCH101; ARCH220; ENGL101; COMM200","Morgan interior design students need steady studio progression plus materials, documentation, and professional-practice readiness.","Use studio courses as anchors each term and avoid delaying materials or professional-practice work."
Marketing,Business Administration,"ACCT201; ECON201; ECON202; MGMT220; MKTG210; MKTG331; STAT302; ENGL101; ENGL102; COMM200","Morgan marketing students move from shared business fundamentals into marketing strategy and market analysis.","Use MKTG210 as the transition point into upper-level marketing work and keep economics plus statistics in place for stronger planning."
Entrepreneurship,Business Administration,"ACCT201; ECON201; MGMT220; MKTG210; ENTR300; ENTR410; STAT302; ENGL101; ENGL102","Morgan entrepreneurship students combine a shared business core with venture creation and applied strategy for new enterprise development.","Build accounting management marketing and quantitative context before venture-heavy coursework."
Hospitality Management,Business Administration,"ACCT201; ECON201; MGMT220; MKTG210; STAT302; ENGL101; ENGL102; COMM200","Hospitality Management students combine a shared business core with service operations and leadership preparation.","Build the business core first so upper-level hospitality planning has enough operational context."
Human Resource Management,Business Administration,"ACCT201; ECON201; MGMT220; MGMT330; STAT302; ENGL101; ENGL102; COMM200","Human Resource Management students combine shared business preparation with organizational behavior and people-management direction.","Use the lower-division business and management core as the base for later HR-focused planning."
Elementary Education,Education,"EDUC200; EDUC220; EDUC310; EDUC320; EDUC330; EDUC410; ENGL101; ENGL102; PSYC101; PSYC210; MATH141","Elementary Education students build child-development and teaching-methods foundations before internship and certification-focused work.","Move through the early education sequence on time so upper-level methods and internship planning stay aligned with teacher-prep milestones."
Philosophy,Philosophy,"PHIL101; PHIL201; PHIL220; PHIL310; PHIL330; PHIL401; ENGL101; ENGL102","Morgan philosophy study emphasizes ethics, logic, religion, and advanced critical reasoning useful for law, public service, and graduate study.","Take logic and writing-intensive coursework early so upper-level theory and seminar work are easier to sequence."
Physics,Physics,"PHYS101; PHYS102; PHYS201; PHYS310; PHYS320; PHYS401; MATH141; MATH241; MATH243; CHEM101","Morgan's physics program emphasizes mathematical preparation, laboratory science, and advanced physical reasoning for research and technical careers.","Stay on pace through calculus and the introductory physics sequence so upper-level theory and seminar work remain accessible."
